{
  "scene_version": "shadow-3d-scene-v1",
  "profile_id": "coding-agent-v1",
  "profile_version": "1.0",
  "bundle_id": "coding-agent-v1-fixture",
  "bundle_hash": "d9055ba1c3220cbaf745799f499036738bc2fe689e5a319ffe8cd19e1cab09d9",
  "status_mode": "FIXTURE",
  "view_mode": "audit",
  "layout_mode": "arc",
  "layout_seed": 20260721,
  "nodes": [
    {
      "id": "coding-agent-v1:n0:issue",
      "type": "issue",
      "sequence": 0,
      "timestamp": null,
      "status": "VERIFIED",
      "claim_ids": [],
      "evidence_ids": [],
      "source_ids": [
        "coding-agent-v1:src0"
      ],
      "agent": "coding-agent",
      "tool": null,
      "model": null,
      "label_short": "Issue #412",
      "label_full": "Issue #412 (seq 0, issue)",
      "accessibility": "issue at sequence 0: Issue #412, status VERIFIED",
      "label_priority": "P2",
      "focus_state": false,
      "selected_state": false,
      "expanded_state": false,
      "layout_hint": {
        "ring": 0.9,
        "angle_deg": -60,
        "height": -0.35,
        "column": 0
      },
      "evidence_ref": "coding-agent-v1:src0"
    },
    {
      "id": "coding-agent-v1:n1:tool_call",
      "type": "tool_call",
      "sequence": 1,
      "timestamp": null,
      "status": "VERIFIED",
      "claim_ids": [],
      "evidence_ids": [],
      "source_ids": [],
      "agent": "coding-agent",
      "tool": "Edit",
      "model": null,
      "label_short": "tool: Edit",
      "label_full": "tool: Edit (seq 1, tool_call)",
      "accessibility": "tool_call at sequence 1: tool: Edit, status VERIFIED",
      "label_priority": "P2",
      "focus_state": false,
      "selected_state": false,
      "expanded_state": false,
      "layout_hint": {
        "ring": 0.9,
        "angle_deg": -40,
        "height": -0.35,
        "column": 1
      },
      "evidence_ref": null
    },
    {
      "id": "coding-agent-v1:n2:diff",
      "type": "diff",
      "sequence": 2,
      "timestamp": null,
      "status": "VERIFIED",
      "claim_ids": [],
      "evidence_ids": [
        "coding-agent-v1:ev2"
      ],
      "source_ids": [],
      "agent": "coding-agent",
      "tool": null,
      "model": null,
      "label_short": "diff EventSystem",
      "label_full": "diff EventSystem (seq 2, diff)",
      "accessibility": "diff at sequence 2: diff EventSystem, status VERIFIED",
      "label_priority": "P2",
      "focus_state": false,
      "selected_state": false,
      "expanded_state": false,
      "layout_hint": {
        "ring": 0.9,
        "angle_deg": -20,
        "height": -0.35,
        "column": 2
      },
      "evidence_ref": null
    },
    {
      "id": "coding-agent-v1:n3:test",
      "type": "test",
      "sequence": 3,
      "timestamp": null,
      "status": "VERIFIED",
      "claim_ids": [],
      "evidence_ids": [],
      "source_ids": [],
      "agent": "coding-agent",
      "tool": null,
      "model": null,
      "label_short": "test: PlayMode",
      "label_full": "test: PlayMode (seq 3, test)",
      "accessibility": "test at sequence 3: test: PlayMode, status VERIFIED",
      "label_priority": "P2",
      "focus_state": false,
      "selected_state": false,
      "expanded_state": false,
      "layout_hint": {
        "ring": 0.9,
        "angle_deg": 0,
        "height": -0.35,
        "column": 3
      },
      "evidence_ref": null
    },
    {
      "id": "coding-agent-v1:n4:commit",
      "type": "commit",
      "sequence": 4,
      "timestamp": null,
      "status": "VERIFIED",
      "claim_ids": [],
      "evidence_ids": [],
      "source_ids": [],
      "agent": "coding-agent",
      "tool": null,
      "model": null,
      "label_short": "commit 6f6d9de",
      "label_full": "commit 6f6d9de (seq 4, commit)",
      "accessibility": "commit at sequence 4: commit 6f6d9de, status VERIFIED",
      "label_priority": "P1",
      "focus_state": false,
      "selected_state": false,
      "expanded_state": false,
      "layout_hint": {
        "ring": 0.9,
        "angle_deg": 20,
        "height": -0.35,
        "column": 4
      },
      "evidence_ref": null
    },
    {
      "id": "coding-agent-v1:n5:signature",
      "type": "signature",
      "sequence": 5,
      "timestamp": null,
      "status": "VERIFIED",
      "claim_ids": [],
      "evidence_ids": [],
      "source_ids": [],
      "agent": "coding-agent",
      "tool": null,
      "model": null,
      "label_short": "Ed25519 seal",
      "label_full": "Ed25519 seal (seq 5, signature)",
      "accessibility": "signature at sequence 5: Ed25519 seal, status VERIFIED",
      "label_priority": "P1",
      "focus_state": false,
      "selected_state": false,
      "expanded_state": false,
      "layout_hint": {
        "ring": 0.9,
        "angle_deg": 40,
        "height": -0.35,
        "column": 5
      },
      "evidence_ref": null
    },
    {
      "id": "coding-agent-v1:n6:audit_record",
      "type": "audit_record",
      "sequence": 6,
      "timestamp": null,
      "status": "VERIFIED",
      "claim_ids": [],
      "evidence_ids": [],
      "source_ids": [],
      "agent": "coding-agent",
      "tool": null,
      "model": null,
      "label_short": "Audit record",
      "label_full": "Audit record (seq 6, audit_record)",
      "accessibility": "audit_record at sequence 6: Audit record, status VERIFIED",
      "label_priority": "P0",
      "focus_state": false,
      "selected_state": false,
      "expanded_state": false,
      "layout_hint": {
        "ring": 0.9,
        "angle_deg": 60,
        "height": -0.35,
        "column": 6
      },
      "evidence_ref": null
    }
  ],
  "edges": [
    {
      "id": "e1",
      "type": "DERIVED_FROM",
      "from": "coding-agent-v1:n1:tool_call",
      "to": "coding-agent-v1:n0:issue",
      "direction": "backward"
    },
    {
      "id": "e2",
      "type": "DERIVED_FROM",
      "from": "coding-agent-v1:n2:diff",
      "to": "coding-agent-v1:n1:tool_call",
      "direction": "backward"
    },
    {
      "id": "e3",
      "type": "DERIVED_FROM",
      "from": "coding-agent-v1:n3:test",
      "to": "coding-agent-v1:n2:diff",
      "direction": "backward"
    },
    {
      "id": "e4",
      "type": "DERIVED_FROM",
      "from": "coding-agent-v1:n4:commit",
      "to": "coding-agent-v1:n3:test",
      "direction": "backward"
    },
    {
      "id": "e5",
      "type": "SEALED_BY",
      "from": "coding-agent-v1:n5:signature",
      "to": "coding-agent-v1:n4:commit",
      "direction": "backward"
    },
    {
      "id": "e6",
      "type": "DERIVED_FROM",
      "from": "coding-agent-v1:n6:audit_record",
      "to": "coding-agent-v1:n5:signature",
      "direction": "backward"
    }
  ],
  "tamper": null,
  "verification": {
    "record_integrity": "VERIFIED",
    "signature": "VERIFIED",
    "hash_chain": "VERIFIED",
    "profile": "VERIFIED",
    "source_resolution": "NOT_PRESENT",
    "external_anchor": "NOT_PRESENT",
    "analytical_correctness": "NOT_EVALUATED"
  }
}
